"code","id","name"
A000,1,"COLERA DEBIDO A VIBRIO CHOLERAE O1, BIOTIPO CHOLERAE"
A001,2,"COLERA DEBIDO A VIBRIO CHOLERAE O1, BIOTIPO EL TOR"
A009,3,COLERA NO ESPECIFICADO
A010,4,FIEBRE TIFOIDEA
A011,5,FIEBRE PARATIFOIDEA A
A012,6,FIEBRE PARATIFOIDEA B
A013,7,FIEBRE PARATIFOIDEA C
A014,8,"FIEBRE PARATIFOIDEA, NO ESPECIFICADA"
A020,9,ENTERITIS DEBIDA A SALMONELLA
A021,10,SEPTICEMIA DEBIDA A SALMONELLA
A022,11,INFECCIONES LOCALIZADAS DEBIDA A SALMONELLA
A028,12,OTRAS INFECCIONES ESPECIFICADAS COMO DEBIDAS A SALMONELLA
A029,13,INFECCIÓN DEBIDA A SALMONELLA NO ESPECIFICADA
A030,14,SHIGELOSIS DEBIDA A SHIGELLA DYSENTERIAE
A031,15,SHIGELOSIS DEBIDA A SHIGELLA FLEXNERI
A032,16,SHIGELOSIS DEBIDA A SHIGELLA BOYDII
A033,17,SHIGELOSIS DEBIDA A SHIGELLA SONNEI
A038,18,OTRAS SHIGELOSIS
A039,19,SHIGELOSIS DE TIPO NO ESPECIFICADO
A040,20,INFECCION DEBIDA A ESCHERICHIA COLI ENTEROPATOGENA
A041,21,INFECCION DEBIDA A ESCHERICHIA COLI ENTEROTOXIGENA
A042,22,INFECCION DEBIDA A ESCHERICHIA COLI ENTEROINVASIVA
A043,23,INFECCION DEBIDA A ESCHERICHIA COLI ENTEROHEMORRAGICA
A044,24,OTRAS INFECCIONES INTESTINALES DEBIDAS A ESCHERICHIA COLI
A045,25,ENTERITIS DEBIDA A CAMPYLOBACTER
A046,26,ENTERITIS DEBIDA A YERSINIA ENTEROCOLITICA
A047,27,ENTEROCOLITIS DEBIDA A CLOSTRIDIUM DIFFICILE
A048,28,OTRAS INFECCIONES INTESTINALES BACTERIANAS ESPECIFICADAS
A049,29,"INFECCION INTESTINAL BACTERIANA, NO ESPECIFICADA"
A050,30,INTOXICACION ALIMENTARIA ESTAFILOCOCICA
A051,31,BOTULISMO
A052,32,INTOXICACION ALIMENTARIA DEBIDA A CLOSTRIDIUM PERFRINGENS [CLOSTRIDIUM WELCHII]
A053,33,INTOXICACION ALIMENTARIA DEBIDA A VIBRIO PARAHAEMOLYTICUS
A054,34,INTOXICACION ALIMENTARIA DEBIDA A BACILLUS CEREUS
A058,35,OTRAS INTOXICACIONES ALIMENTARIAS DEBIDAS A BACTERIAS ESPECIFICADAS
A059,36,"INTOXICACION ALIMENTARIA BACTERIANA, NO ESPECIFICADA"
A060,37,DISENTERIA AMEBIANA AGUDA
A061,38,AMEBIASIS INTESTINAL CRONICA
A062,39,COLITIS AMEBIANA NO DISENTERICA
A063,40,AMEBOMA INTESTINAL
A064,41,ABSCESO AMEBIANO DEL HIGADO
A065,42,ABSCESO AMEBIANO DEL PULMON (J99.8*)
A066,43,ABSCESO AMEBIANO DEL CEREBRO (G07*)
A067,44,AMEBIASIS CUTANEA
A068,45,INFECCION AMEBIANA DE OTRAS LOCALIZACIONES
A069,46,"AMEBIASIS, NO ESPECIFICADA"
A070,47,BALANTIDIASIS
A071,48,GIARDIASIS [LAMBLIASIS]
A072,49,CRIPTOSPORIDIOSIS
A073,50,ISOSPORIASIS
A078,51,OTRAS ENFERMEDADES INTESTINALES ESPECIFICADAS DEBIDAS A PROTOZOARIOS
A079,52,"ENFERMEDAD INTESTINAL DEBIDA A PROTOZOARIOS, NO ESPECIFICADA"
A080,53,ENTERITIS DEBIDA A ROTAVIRUS
A081,54,GASTROENTEROPATIA AGUDA DEBIDA AL AGENTE DE NORWALK
A082,55,ENTERITIS DEBIDA A ADENOVIRUS
A083,56,OTRAS ENTERITIS VIRALES
A084,57,"INFECCION INTESTINAL VIRAL, SIN OTRA ESPECIFICACION"
A085,58,OTRAS INFECCIONES INTESTINALES ESPECIFICADAS
A09,59,DIARREA Y GASTROENTERITIS DE PRESUNTO ORIGEN INFECCIOSO
A150,60,"TUBERCULOSIS DEL PULMON, CONFIRMADA POR HALLAZGO MICROSCOPICO DEL BACILO TUBERCULOSO EN ESPUTO, CON O SIN CULTIVO"
A151,61,"TUBERCULOSIS DEL PULMON, CONFIRMADA UNICAMENTE POR CULTIVO"
A152,62,"TUBERCULOSIS DEL PULMON, CONFIRMADA HISTOLOGICAMENTE"
A153,63,"TUBERCULOSIS DEL PULMON , CONFIRMADA POR MEDIOS NO ESPECIFICADOS"
A154,64,"TUBERCULOSIS DE GANGLIOS LINFATICOS INTRATORACICOS, CONFIRMADA BACTERIOLOGICA E HISTOLOGICAMENTE"
A155,65,"TUBERCULOSIS DE LARINGE, TRAQUEA Y BRONQUIOS, CONFIRMADA BACTERIOLOGICA E HISTOLOGICAMENTE"
A156,66,"PLEURESIA TUBERCULOSA, CONFIRMADA BACTERIOLOGICA E HISTOLOGICAMENTE"
A157,67,"TUBERCULOSIS RESPIRATORIA PRIMARIA, CONFIRMADA BACTERIOLOGICA E HISTOLOGICAMENTE"
A158,68,"OTRAS TUBERCULOSIS RESPIRATORIAS, CONFIRMADAS BACTERIOLOGICA E HISTOLOGICAMENTE"
A159,69,"TUBERCULOSIS RESPIRATORIA NO ESPECIFICADA, CONFIRMADA BACTERIOLOGICAMENTE E HISTOLOGICAMENTE"
A160,70,"TUBERCULOSIS DEL PULMON, CON EXAMEN BACTERIOLOGICO E HISTOLOGICO NEGATIVOS"
A161,71,"TUBERCULOSIS DEL PULMON, SIN EXAMEN BACTERIOLOGICO E HISTOLOGICO"
A162,72,"TUBERCULOSIS DE PULMON, SIN MENCION DE CONFIRMACION BACTERIOLOGICA O HISTOLOGICA"
A163,73,"TUBERCULOSIS DE GANGLIOS LINFATICOS INTRATORACICOS, SIN MENCION DE CONFIRMACION BACTERIOLOGICA O HISTOLOGICA"
A164,74,"TUBERCULOSIS DE LARINGE, TRAQUEA Y BRONQUIOS, SIN MENCION DE CONFIRMACION BACTERIOLOGICA O HISTOLOGICA"
A165,75,"PLEURESIA TUBERCULOSA, SIN MENCION DE CONFIRMACION BACTERIOLOGICA E HISTOLOGICA"
A167,76,"TUBERCULOSIS RESPIRATORIA PRIMARIA, SIN MENCION DE CONFIRMACION BACTERIOLOGICA E HISTOLOGICA"
A168,77,"OTRAS TUBERCULOSIS RESPIRATORIAS, SIN MENCION DE CONFIRMACION"
A169,78,"TUBERCULOSIS RESPIRATORIA NO ESPECIFICADA, SIN MENCION DE CONFIRMACION BACTERIOLOGICA O HISTOLOGICA"
A170,79,MENINGITIS TUBERCULOSA (G01*)
A171,80,TUBERCULOMA MENINGEO (G07*)
A178,81,OTRAS TUBERCULOSIS DEL SISTEMA NERVIOSO
A179,82,"TUBERCULOSIS DEL SISTEMA NERVIOSO, NO ESPECIFICADA (G99.8*)"
A180,83,TUBERCULOSIS DE HUESOS Y ARTICULACIONES
A181,84,TUBERCULOSIS DEL APARATO GENITOURINARIO
A182,85,LINFADENOPATIA PERIFERICA TUBERCULOSA
A183,86,"TUBERCULOSIS DE LOS INTESTINOS, EL PERITONEO Y LOS GANGLIOS MESENTERICOS"
A184,87,TUBERCULOSIS DE LA PIEL Y EL TEJIDO SUBCUTANEO
A185,88,TUBERCULOSIS DEL OJO
A186,89,TUBERCULOSIS DEL OIDO
A187,90,TUBERCULOSIS DE GLANDULAS SUPRARRENALES (E35.1*)
A188,91,TUBERCULOSIS DE OTROS ORGANOS ESPECIFICADOS
A190,92,TUBERCULOSIS MILIAR AGUDA DE UN SOLO SITIO ESPECIFICADO
A191,93,TUBERCULOSIS MILIAR AGUDA DE SITIOS MULTIPLES
A192,94,"TUBERCULOSIS MILIAR AGUDA, NO ESPECIFICADA"
A198,95,OTRAS TUBERCULOSIS MILIARES
A199,96,"TUBERCULOSIS MILIAR, SIN OTRA ESPECIFICACION"
A200,97,PESTE BUBONICA
A201,98,PESTE CELULOCUTANEA
A202,99,PESTE NEUMONICA
A203,100,MENINGITIS POR PESTE
A207,101,PESTE SEPTICEMICA
A208,102,OTRAS FORMAS DE PESTE
A209,103,"PESTE, NO ESPECIFICADA"
A210,104,TULAREMIA ULCEROGLANDULAR
A211,105,TULAREMIA OCULOGLANDULAR
A212,106,TULAREMIA PULMONAR
A213,107,TULAREMIA GASTROINTESTINAL
A217,108,TULAREMIA GENERALIZADA
A218,109,OTRAS FORMAS DE TULAREMIA
A219,110,"TULAREMIA , NO ESPECIFICADA"
A220,111,CARBUNCO CUTANEO
A221,112,CARBUNCO PULMONAR
A222,113,CARBUNCO GASTROINTESTINAL
A227,114,CARBUNCO SEPTICEMICO
A228,115,OTRAS FORMAS DE CARBUNCO
A229,116,"CARBUNCO, NO ESPECIFICADO"
A230,117,BRUCELOSIS DEBIDA A BRUCELLA MELITENSIS
A231,118,BRUCELOSIS DEBIDA A BRUCELLA ABORTUS
A232,119,BRUCELOSIS DEBIDA A BRUCELLA SUIS
A233,120,BRUCELOSIS DEBIDA A BRUCELLA CANIS
A238,121,OTRAS BRUCELOSIS
A239,122,"BRUCELOSIS, NO ESPECIFICADA"
A240,123,MUERMO
A241,124,MELIOIDOSIS AGUDA Y FULMINANTE
A242,125,MELIOIDOSIS SUBAGUDA Y CRONICA
A243,126,OTRAS MELIOIDOSIS
A244,127,"MELIOIDOSIS , NO ESPECIFICADA"
A250,128,ESPIRILOSIS
A251,129,ESTREPTOBACILOSIS
A259,130,"FIEBRE POR MORDEDURA DE RATA, NO ESPECIFICADA"
A260,131,ERISIPELOIDE CUTANEO
A267,132,SEPTICEMIA POR ERYSIPELOTHRIX
A268,133,OTRAS FORMAS DE ERISIPELOIDE
A269,134,"ERISIPELOIDE, NO ESPECIFICADA"
A270,135,LEPTOSPIROSIS ICTEROHEMORRAGICA
A278,136,OTRAS FORMAS DE LEPTOSPIROSIS
A279,137,"LEPTOSPIROSIS, NO ESPECIFICADA"
A280,138,PASTEURELOSIS
A281,139,ENFERMEDAD POR RASGUÑO DE GATO
A282,140,YERSINIOSIS EXTRAINTESTINAL
A288,141,"OTRAS ENFERMEDADES ZOONOTICAS BACTERIANAS ESPECIFICADAS, NO CLASIFICADAS EN OTRA PARTE"
A289,142,"ENFERMEDAD ZOONOTICA BACTERIANA, SIN OTRA ESPECIFICACION"
A300,143,LEPRA INDETERMINADA
A301,144,LEPRA TUBERCULOIDE
A302,145,LEPRA TUBERCULOIDE LIMITROFE
A303,146,LEPRA LIMITROFE
A304,147,LEPRA LEPROMATOSA LIMITROFE
A305,148,LEPRA LEPROMATOSA
A308,149,OTRAS FORMAS DE LEPRA
A309,150,"LEPRA, NO ESPECIFICADA"
A310,151,INFECCIONES POR MICOBACTERIAS PULMONARES
A311,152,INFECCION CUTANEA POR MICOBACTERIAS
A318,153,OTRAS INFECCIONES POR MICOBACTERIAS
A319,154,"INFECCION POR MICOBACTERIA, NO ESPECIFICADA"
A320,155,LISTERIOSIS CUTANEA
A321,156,MENINGITIS Y MENINGOENCEFALITIS LISTERIANA
A327,157,SEPTICEMIA LISTERIANA
A328,158,OTRAS FORMAS DE LISTERIOSIS
A329,159,"LISTERIOSIS, NO ESPECIFICADA"
A33,160,TETANOS NEONATAL
A34,161,TETANOS OBSTETRICO
A35,162,OTROS TETANOS
A360,163,DIFTERIA FARINGEA
A361,164,DIFTERIA NASOFARINGEA
A362,165,DIFTERIA LARINGEA
A363,166,DIFTERIA CUTANEA
A368,167,OTRAS DIFTERIAS
A369,168,"DIFTERIA, NO ESPECIFICADA"
A370,169,TOS FERINA DEBIDA A BORDETELLA PERTUSSIS
A371,170,TOS FERINA DEBIDA A BORDETELLA PARAPERTUSSIS
A378,171,TOS FERINA DEBIDA A OTRAS ESPECIES DE BORDETELLA
A379,172,"TOS FERINA, NO ESPECIFICADA"
A38,173,ESCARLATINA
A390,174,MENINGITIS MENINGOCOCICA (G01*)
A391,175,SINDROME DE WATERHOUSE-FRIDERICHSEN (E35.1*)
A392,176,MENINGOCOCEMIA AGUDA
A393,177,MENINGOCOCEMIA CRONICA
A394,178,"MENINGOCOCEMIA, NO ESPECIFICADA"
A395,179,ENFERMEDAD CARDIACA DEBIDA A MENINGOCOCO
A398,180,OTRAS INFECCIONES MENINGOCOCICAS
A399,181,"INFECCION MENINGOCOCICA, NO ESPECIFICADA"
A400,182,"SEPTICEMIA DEBIDA A ESTREPTOCOCO, GRUPO A"
A401,183,"SEPTICEMIA DEBIDA A ESTREPTOCOCO, GRUPO B"
A402,184,"SEPTICEMIA DEBIDA A ESTREPTOCOCO, GRUPO D"
A403,185,SEPTICEMIA DEBIDA A STREPTOCOCCUS PNEUMONIAE
A408,186,OTRAS SEPTICEMIAS ESTREPTOCOCICAS
A409,187,"SEPTICEMIA ESTREPTOCOCICA, NO ESPECIFICADA"
A410,188,SEPTICEMIA DEBIDA STAPHYLOCOCCUS AUREUS
A411,189,SEPTICEMIA DEBIDA A OTRO ESTAFILOCOCO ESPECIFICADO
A412,190,SEPTICEMIA DEBIDA A ESTAFILOCOCO NO ESPECIFICADO
A413,191,SEPTICEMIA DEBIDA A HAEMOPHILUS INFLUENZAE
A414,192,SEPTICEMIA DEBIDA A ANAEROBIOS
A415,193,SEPTICEMIA DEBIDA A OTROS ORGANISMOS GRAMNEGATIVOS
A418,194,OTRAS SEPTICEMIAS ESPECIFICADAS
A419,195,"SEPTICEMIA, NO ESPECIFICADA"
A420,196,ACTINOMICOSIS PULMONAR
A421,197,ACTINOMICOSIS ABDOMINAL
A422,198,ACTINOMICOSIS CERVICOFACIAL
A427,199,SEPTICEMIA ACTINOMICOTICA
A428,200,OTRAS FORMAS DE ACTINOMICOSIS
A429,201,"ACTINOMICOSIS, SIN OTRA ESPECIFICACION"
A430,202,NOCARDIOSIS PULMONAR
A431,203,NOCARDIOSIS CUTANEA
A438,204,OTRAS FORMAS DE NOCARDIOSIS
A439,205,"NORCARDIOSIS , NO ESPECIFICADA"
A440,206,BARTONELOSIS SISTEMICA
A441,207,BARTONELOSIS CUTANEA Y MUCOCUTANEA
A448,208,OTRAS FORMAS DE BARTONELOSIS
A449,209,"BARTONELOSIS, NO ESPECIFICADA"
A46,210,ERISIPELA
A480,211,GANGRENA GASEOSA
A481,212,ENFERMEDAD DE LOS LEGIONARIOS
A482,213,ENFERMEDAD DE LOS LEGIONARIOS NO NEUMONICA [FIEBRE DE PONTIAC]
A483,214,SINDROME DE CHOQUE TOXICO
A484,215,FIEBRE PURPURICA BRASILEÑA
A488,216,OTRAS ENFERMEDADES BACTERIANAS ESPECIFICADAS
A490,217,"INFECCION ESTAFILOCOCICA, SIN OTRA ESPECIFICACIÓN"
A491,218,"INFECCION ESTREPTOCOCICA, SIN OTRA ESPECIFICACION"
A492,219,"INFECCION POR HAEMOPHILUS INFLUENZAE, SIN OTRA ESPECIFICACION"
A493,220,"INFECCION POR MICOPLASMA, SIN OTRA ESPECIFICACION"
A498,221,OTRAS INFECCIONES BACTERIANAS DE SITIO NO ESPECIFICADO
A499,222,"INFECCION BACTERIANA, NO ESPECIFICADA"
A500,223,"SIFILIS CONGENITA PRECOZ, SINTOMATICA"
A501,224,"SIFILIS CONGENITA PRECOZ, LATENTE"
A502,225,SIFILIS CONGENITA PRECOZ SIN OTRA ESPECIFICACIÓN
A503,226,OCULOPATIA SIFILITICA CONGENITA TARDIA
A504,227,NEUROSIFILIS CONGENITA TARDIA [NEUROSIFILIS JUVENIL]
A505,228,"OTRAS FORMAS DE SIFILIS CONGENITA TARDIA, SINTOMATICA"
A506,229,"SIFILIS CONGENITA TARDIA, LATENTE"
A507,230,"SIFILIS CONGENITA TARDIA, SIN OTRA ESPECIFICACION"
A509,231,"SIFILIS CONGENITA, SIN OTRA ESPECIFICACIÓN"
A510,232,SIFILIS GENITAL PRIMARIA
A511,233,SIFILIS PRIMARIA ANAL
A512,234,SIFILIS PRIMARIA EN OTROS SITIOS
A513,235,SIFILIS SECUNDARIA DE PIEL Y MEMBRANAS MUCOSAS
A514,236,OTRAS SIFILIS SECUNDARIAS
A515,237,"SIFILIS PRECOZ, LATENTE"
A519,238,"SIFILIS PRECOZ, SIN OTRA ESPECIFICACIÓN"
A520,239,SIFILIS CARDIOVASCULAR
A521,240,NEUROSIFILIS SINTOMATICA
A522,241,NEUROSIFILIS ASINTOMATICA
A523,242,NEUROSIFILIS NO ESPECIFICADA
A527,243,OTRAS SIFILIS TARDIAS SINTOMATICAS
A528,244,"SIFILIS TARDIA, LATENTE"
A529,245,"SIFILIS TARDIA, NO ESPECIFICADA"
A530,246,"SIFILIS LATENTE, NO ESPECIFICADA COMO PRECOZ O TARDIA"
A539,247,"SIFILIS, NO ESPECIFICADA"
A540,248,INFECCION GONOCOCICA DEL TRACTO GENITOURINARIO INFERIOR SIN ABSCESO PERIURETRAL O DE GLANDULA ACCESORIA
A541,249,INFECCION GONOCOCICA DEL TRACTO GENITOURINARIO INFERIOR CON ABSCESO PERIURETRAL Y DE GLANDULAS ACCESORIAS
A542,250,PELVIPERITONITIS GONOCOCICA Y OTRAS INFECCIONES GONOCOCICAS GENITOURINARIAS
A543,251,INFECCION GONOCOCICA DEL OJO
A544,252,INFECCION GONOCOCICA DEL SISTEMA OSTEOMUSCULAR
A545,253,FARINGITIS GONOCOCICA
A546,254,INFECCION GONOCOCICA DEL ANO Y DEL RECTO
A548,255,OTRAS INFECCIONES GONOCOCICAS
A549,256,"INFECCION, GONOCOCICA, NO ESPECIFICADA"
A55,257,LINFOGRANULOMA (VENEREO) POR CLAMIDIAS
A560,258,INFECCION DEL TRACTO GENITOURINARIO INFERIOR DEBIDA A CLAMIDIAS
A561,259,INFECCION DEL PELVIPERITONEO Y OTROS ORGANOS GENITOURINARIOS DEBIDA A CLAMIDIAS
A562,260,"INFECCIONES DEL TRACTO GENITOURINARIO DEBIDAS A CLAMIDIAS, SIN OTRA ESPECIFICACION"
A563,261,INFECCION DEL ANO Y DEL RECTO DEBIDA A CLAMIDIAS
A564,262,INFECCION DE FARINGE DEBIDA A CLAMIDIAS
A568,263,INFECCION DE TRANSMISIÓN SEXUAL DE OTROS SITIOS DEBIDA A CLAMIDIAS
A57,264,CHANCRO BLANDO
A58,265,GRANULOMA INGUINAL
A590,266,TRICOMONIASIS UROGENITAL
A598,267,TRICOMONIASIS DE OTROS SITIOS
A599,268,"TRICOMONIASIS, NO ESPECIFICADA"
A600,269,INFECCION DE GENITALES Y TRAYECTO UROGENITAL Y DEBIDA A VIRUS DEL HERPES [HERPES SIMPLE]
A601,270,INFECCION DE LA PIEL PERIANAL Y RECTO POR VIRUS DEL HERPES SIMPLE
A609,271,"INFECCION ANOGENITAL POR VIRUS DEL HERPES SIMPLE, SIN OTRA ESPECIFICACION"
A630,272,VERRUGAS (VENEREAS) ANOGENITALES
A638,273,"OTRAS ENFERMEDADES DE TRANSMISIÓN PREDOMINANTEMENTE SEXUAL, ESPECIFICADAS"
A64,274,ENFERMEDAD DE TRANSMISION SEXUAL NO ESPECIFICADA
A65,275,SIFILIS NO VENEREA
A660,276,LESIONES INICIALES DE FRAMBESIA
A661,277,LESIONES PAPILOMATOSAS MULTIPLES Y FRAMBESIA CON PASO DE CANGREJO
A662,278,OTRAS LESIONES PRECOCES DE LA PIEL EN LA FRAMBESIA
A663,279,HIPERQUERATOSIS DE FRAMBESIA
A664,280,GOMA Y ULCERAS DE FRAMBESIA
A665,281,GANGOSA
A666,282,LESIONES FRAMBESICAS DE LOS HUESOS Y DE LAS ARTICULACIONES
A667,283,OTRAS MANIFESTACIONES DE FRAMBESIA
A668,284,FRAMBESIA LATENTE
A669,285,"FRAMBESIA , NO ESPECIFICADA"
A670,286,LESIONES PRIMARIAS DE LA PINTA
A671,287,LESIONES INTERMEDIAS DE LA PINTA
A672,288,LESIONES TARDIAS DE LA PINTA
A673,289,LESIONES MIXTAS DE LA PINTA
A679,290,"PINTA, NO ESPECIFICADA"
A680,291,FIEBRE RECURRENTE TRANSMITIDA POR PIOJOS
A681,292,FIEBRE RECURRENTE TRANSMITIDA POR GARRAPATAS
A689,293,"FIEBRE RECURRENTE, NO ESPECIFICADA"
A690,294,ESTOMATITIS ULCERATIVA NECROTIZANTE
A691,295,OTRAS INFECCIONES DE VICENT
A692,296,ENFERMEDAD DE LYME
A698,297,OTRAS INFECCIONES ESPECIFICADAS POR ESPIROQUETAS
A699,298,"INFECCION POR ESPIROQUETA, NO ESPECIFICADA"
A70,299,INFECCION DEBIDA A CHLAMYDIA PSITTACI
A710,300,ESTADO INICIAL DE TRACOMA
A711,301,ESTADO ACTIVO DE TRACOMA
A719,302,"TRACOMA, NO ESPECIFICADO"
A740,303,CONJUNTIVITIS POR CLAMIDIAS (H13.1*)
A748,304,OTRAS ENFERMEDADES POR CLAMIDIAS
A749,305,"INFECCION POR CLAMIDIAS, NO ESPECIFICADA"
A750,306,TIFUS EPIDEMICO DEBIDO A RICKETTSIA PROWAZEKII TRANSMITIDO POR PIOJOS
A751,307,TIFUS RECRUDESCENTE [ENFERMEDAD DE BRILL]
A752,308,TIFUS DEBIDO A RICKETTSIA TYPHI
A753,309,TIFUS DEBIDO A RICKETTSIA TSUTSUGAMUSHI
A759,310,"TIFUS, NO ESPECIFICADO"
A770,311,FIEBRE MACULOSA DEBIDO A RICKETTSIA RICKETTSII
A771,312,FIEBRE MACULOSA DEBIDO A RICKETTSIA CONORII
A772,313,FIEBRE MACULOSA DEBIDO A RICKETTSIA SIBERICA
A773,314,FIEBRE MACULOSA DEBIDO A RICKETTSIA AUSTRALIS
A778,315,OTRAS FIEBRES MACULOSAS
A779,316,"FIEBRE MACULOSA, NO ESPECIFICADA"
A78,317,FIEBRE Q
A790,318,FIEBRE DE LAS TRINCHERAS
A791,319,RICKETTSIOSIS PUSTULOSA DEBIDA A RICKETTSIA AKARI
A798,320,OTRAS RICKETTSIOSIS ESPECIFICADAS
A799,321,"RICKETTSIOSIS, NO ESPECIFICADA"
A800,322,"POLIOMIELITIS AGUDA PARALITICA, ASOCIADA A VACUNA"
A801,323,POLIOMIELITIS AGUDA PARALITICA DEBIDA A VIRUS SALVAJE IMPORTADO
A802,324,POLIOMIELITIS AGUDA PARALITICA DEBIDA A VIRUS SALVAJE AUTOCTONO
A803,325,"OTRAS POLIOMIELITIS AGUDAS PARALITICAS, Y NO LAS ESPECIFICADAS"
A804,326,POLIOMIELITIS AGUDA NO PARALITICA
A809,327,"POLIOMIELITIS AGUDA, SIN OTRA ESPECIFICACIÓN"
A810,328,ENFERMEDAD DE CREUTZFELDT-JAKOB
A811,329,PANENCEFALITIS ESCLEROSANTE SUBAGUDA
A812,330,LEUCOENCEFALOPATIA MULTIFOCAL PROGRESIVA
A818,331,OTRAS INFECCIONES DEL SISTEMA NERVIOSO POR VIRUS ATIPICO
A819,332,"INFECCIONES DEL SISTEMA NERVIOSO CENTRAL POR VIRUS ATIPICO, SIN OTRA ESPECIFICACION"
A820,333,RABIA SELVATICA
A821,334,RABIA URBANA
A829,335,"RABIA, SIN OTRA ESPECIFICACION"
A830,336,ENCEFALITIS JAPONESA
A831,337,ENCEFALITIS EQUINA DEL OESTE
A832,338,ENCEFALITIS EQUINA DEL ESTE
A833,339,ENCEFALITIS DE SAN LUIS
A834,340,ENCEFALITIS AUSTRALIANA
A835,341,ENCEFALITIS DE CALIFORNIA
A836,342,ENFERMEDAD POR VIRUS ROCIO
A838,343,OTRAS ENCEFALITIS VIRALES TRANSMITIDAS POR MOSQUITOS
A839,344,"ENCEFALITIS VIRAL TRANSMITIDA POR MOSQUITOS, SIN OTRA ESPECIFICACION"
A840,345,ENCEFALITIS DEL LEJANO ORIENTE TRANSMITIDA POR GARRAPATAS [ENCEFALITIS PRIMAVEROESTIVAL RUSA]
A841,346,ENCEFALITIS CENTROEUROPEA TRANSMITIDA POR GARRAPATAS
A848,347,OTRAS ENCEFALITIS VIRALES TRANSMITIDAS POR GARRAPATAS
A849,348,"ENCEFALITIS VIRAL TRANSMITIDA POR GARRAPATAS, SIN OTRA ESPECIFICACION"
A850,349,ENCEFALITIS ENTEROVIRAL (G05.1*)
A851,350,ENCEFALITIS POR ADENOVIRUS (G05.1*)
A852,351,"ENCEFALITIS VIRAL TRANSMITIDA POR ARTROPODOS, SIN OTRA ESPECIFICACIÓN"
A858,352,OTRAS ENCEFALITIS VIRALES ESPECIFICADAS
A86,353,"ENCEFALITIS VIRAL, NO ESPECIFICADA"
A870,354,MENINGITIS ENTEROVIRAL (G02.0*)
A871,355,MENINGITIS DEBIDA A ADENOVIRUS (G02.0*)
A872,356,CORIOMENINGITIS LINFOCITICA
A878,357,OTRAS MENINGITIS VIRALES
A879,358,"MENINGITIS VIRAL, SIN OTRA ESPECIFICACION"
A880,359,FIEBRE EXANTEMATICA ENTEROVIRAL [EXANTEMA DE BOSTON]
A881,360,VERTIGO EPIDEMICO
A888,361,OTRAS INFECCIONES VIRALES ESPECIFICADAS DEL SISTEMA NERVIOSO CENTRAL
A89,362,"INFECCION VIRAL DEL SISTEMA NERVIOSO CENTRAL, NO ESPECIFICADA"
A90,363,FIEBRE DEL DENGUE [DENGUE CLASICO]
A91,364,FIEBRE DEL DENGUE HEMORRAGICO
A920,365,ENFERMEDAD POR VIRUS CHIKUNGUNYA
A921,366,FIEBRE DE O´NYONG-NYONG
A922,367,FIEBRE EQUINA VENEZOLANA
A923,368,FIEBRE DEL OESTE DEL NILO
A924,369,FIEBRE DEL VALLE DEL RIFT
A928,370,OTRAS FIEBRES VIRALES ESPECIFICADAS TRANSMITIDAS POR MOSQUITOS
A929,371,"FIEBRE VIRAL TRANSMITIDA POR MOSQUITO, SIN OTRA ESPECIFICACION"
A930,372,ENFERMEDAD POR VIRUS DE OROPOUCHE
A931,373,FIEBRE TRANSMITIDA POR FLEBOTOMOS
A932,374,FIEBRE DE COLORADO TRANSMITIDA POR GARRAPATAS
A938,375,OTRAS FIEBRES VIRALES ESPECIFICADAS TRANSMITIDAS POR ANTROPODOS
A94,376,"FIEBRE VIRAL TRANSMITIDA POR ARTROPODOS, NO ESPECIFICADA"
A950,377,FIEBRE AMARILLA SELVATICA
A951,378,FIEBRE AMARILLA URBANA
A959,379,"FIEBRE AMARILLA, NO ESPECIFICADA"
A960,380,FIEBRE HEMORRAGICA DE JUNIN
A961,381,FIEBRE HEMORRAGICA DE MACHUPO
A962,382,FIEBRE DE LASSA
A968,383,OTRAS FIEBRES HEMORRAGICAS POR ARENAVIRUS
A969,384,"FIEBRE HEMORRAGICA POR ARENAVIRUS, SIN OTRA ESPECIFICACION"
A980,385,FIEBRE HEMORRAGICA DE CRIMEA-CONGO
A981,386,FIEBRE HEMORRAGICA DE OMSK
A982,387,ENFERMEDAD DE LA SELVA DE KYASANUR
A983,388,ENFERMEDAD POR EL VIRUS DE MARBURG
A984,389,ENFERMEDAD POR EL VIRUS DE EBOLA
A985,390,FIEBRES HEMORRAGICAS CON SINDROME RENAL
A988,391,OTRAS FIEBRES HEMORRAGICAS VIRALES ESPECIFICADAS
A99,392,"FIEBRE VIRAL HEMORRAGICA, NO ESPECIFICADA"
B000,393,ECZEMA HERPETICO
B001,394,DERMATITIS VESICULAR HERPETICA
B002,395,GINGIVOESTOMATITIS Y FARINGOAMIGDALITIS HERPETICA
B003,396,MENINGITIS HERPETICA (G02.0*)
B004,397,ENCEFALITIS HERPETICA (G05.1*)
B005,398,OCULOPATIA HERPETICA
B007,399,ENFERMEDAD HERPETICA DISEMINADA
B008,400,OTRAS FORMAS DE INFECCIONES HERPETICAS
B009,401,"INFECCION DEBIDA A EL VIRUS DEL HERPES, NO ESPECIFICADA"
B010,402,MENINGITIS DEBIDA A LA VARICELA (G02.0*)
B011,403,ENCEFALITIS DEBIDA A LA VARICELA (G05.1*)
B012,404,NEUMONIA DEBIDA A LA VARICELA (J17.1*)
B018,405,VARICELA CON OTRAS COMPLICACIONES
B019,406,VARICELA SIN COMPLICACIONES
B020,407,ENCEFALITIS DEBIDA A HERPES ZOSTER (G05.1*)
B021,408,MENINGITIS DEBIDA A HERPES ZOSTER (G02.0*)
B022,409,HERPES ZOSTER CON OTROS COMPROMISOS DEL SISTEMA NERVIOSO
B023,410,HERPES ZOSTER OCULAR
B027,411,HERPES ZOSTER DISEMINADO
B028,412,HERPES ZOSTER CON OTRAS COMPLICACIONES
B029,413,HERPES ZOSTER SIN COMPLICACIONES
B03,414,VIRUELA
B04,415,VIRUELA DE LOS MONOS
B050,416,SARAMPION COMPLICADO CON ENCEFALITIS (G05.1*)
B051,417,SARAMPION COMPLICADO CON MENINGITIS (G02.0*)
B052,418,SARAMPION COMPLICADO CON NEUMONIA (J17.1*)
B053,419,SARAMPION COMPLICADO CON OTITIS MEDIA (H67.1*)
B054,420,SARAMPION CON COMPLICACIONES INTESTINALES
B058,421,SARAMPION CON OTRAS COMPLICACIONES
B059,422,SARAMPION SIN COMPLICACIONES
B060,423,RUBEOLA CON COMPLICACIONES NEUROLOGICAS
B068,424,RUBEOLA CON OTRAS COMPLICACIONES
B069,425,RUBEOLA SIN COMPLICACIONES
B07,426,VERRUGAS VIRICAS
B080,427,OTRAS INFECCIONES DEBIDAS A ORTOPOXVIRUS
B081,428,MOLUSCO CONTAGIOSO
B082,429,EXANTEMA SUBITO [SEXTA ENFERMEDAD]
B083,430,ERITEMA INFECCIOSO [QUINTA ENFERMEDAD]
B084,431,ESTOMATITIS VESICULAR ENTEROVIRAL CON EXANTEMA
B085,432,FARINGITIS VESICULAR ENTEROVIRICA
B088,433,"OTRAS INFECCIONES VIRALES ESPECIFICADAS, CARACTERIZADAS POR LESIONES DE LA PIEL Y DE LAS MEMBRANAS MUCOSAS"
B09,434,"INFECCION VIRAL NO ESPECIFICADA, CARACTERIZADA POR LESIONES DE LA PIEL Y DE LAS MEMBRANAS MUCOSAS"
B150,435,"HEPATITIS AGUDA TIPO A, SIN COMA HEPATICO"
B159,436,"HEPATITIS AGUDA TIPO A, CON COMA HEPATICO"
B160,437,"HEPATITIS AGUDA TIPO B, CON AGENTE DELTA (COINFECCION). CON COMA HEPATICO"
B161,438,"HEPATITIS AGUDA TIPO B, CON AGENTE DELTA (COINFECCION), SIN COMA HEPATICO"
B162,439,"HEPATITIS AGUDA TIPO B, SIN AGENTE DELTA, CON COMA HEPATICO"
B169,440,"HEPATITIS AGUDA TIPO B, SIN AGENTE DELTA Y SIN COMA HEPATICO"
B170,441,INFECCION (SUPERINFECCION) AGUDA POR AGENTE DELTA EN EL PORTADOR DE HEPATITIS B
B171,442,HEPATITIS AGUDA TIPO C
B172,443,HEPATITIS AGUDA TIPO E
B178,444,OTRAS HEPATITIS VIRALES AGUDAS ESPECIFICADAS
B180,445,"HEPATITIS VIRAL TIPO B CRONICA, CON AGENTE DELTA"
B181,446,"HEPATITIS VIRAL TIPO B CRONICA, SIN AGENTE DELTA"
B182,447,HEPATITIS VIRAL TIPO C CRONICA
B188,448,OTRAS HEPATITIS VIRALES CRONICAS
B189,449,"HEPATITIS VIRAL CRONICA, SIN OTRA ESPECIFICACION"
B190,450,HEPATITIS VIRAL NO ESPECIFICADA CON COMA
B199,451,HEPATITIS VIRAL NO ESPECIFICADA SIN COMA
B200,452,"ENFERMEDAD POR EL VIH, RESULTANTE EN INFECCION POR MICOBACTERIAS"
B201,453,"ENFERMEDAD POR EL VIH, RESULTANTE EN OTRAS INFECCIONES BACTERIANAS"
B202,454,"ENFERMEDAD POR VIH, RESULTANTE EN ENFERMEDAD POR CITOMEGALOVIRUS"
B203,455,"ENFERMEDAD POR VIH, RESULTANTE EN OTRAS INFECCIONES VIRALES"
B204,456,"ENFERMEDAD POR VIH, RESULTANTE EN CANDIDIASIS"
B205,457,"ENFERMEDAD POR VIH, RESULTANTE EN OTRAS MICOSIS"
B206,458,"ENFERMEDAD POR VIH, RESULTANTE EN NEUMONIA POR PNEUMOCYSTIS CARINII"
B207,459,"ENFERMEDAD POR VIH, RESULTANTE EN INFECCIONES MULTIPLES"
B208,460,"ENFERMEDAD POR VIH, RESULTANTE EN OTRAS ENFERMEDADES INFECCIOSAS O PARASITARIAS"
B209,461,"ENFERMEDAD POR VIH, RESULTANTE EN ENFERMEDAD INFECCIOSA O PARASITARIA NO ESPECIFICADA"
B210,462,"ENFERMEDAD POR VIH, RESULTANTE EN SARCOMA DE KAPOSI"
B211,463,"ENFERMEDAD POR VIH, RESULTANTE EN LINFOMA DE BURKITT"
B212,464,"ENFERMEDAD POR VIH, RESULTANTE EN OTROS TIPOS DE LINFOMA NO HODGKIN"
B213,465,"ENFERMEDAD POR VIH, RESULTANTE EN OTROS TUMORES MALIGNOS DEL TEJIDO LINFOIDE, HEMATOPOYETICO Y TEJIDOS RELACIONADOS"
B217,466,"ENFERMEDAD POR VIH, RESULTANTE EN TUMORES MALIGNOS MULTIPLES"
B218,467,"ENFERMEDAD POR VIH, RESULTANTE EN OTROS TUMORES MALIGNOS"
B219,468,"ENFERMEDAD POR VIH, RESULTANTE EN TUMORES MALIGNOS NO ESPECIFICADOS"
B220,469,"ENFERMEDAD POR VIH, RESULTANTE EN ENCEFALOPATIA"
B221,470,"ENFERMEDAD POR VIH, RESULTANTE EN NEUMONITIS LINFOIDE INTERSTICIAL"
B222,471,"ENFERMEDAD POR VIH, RESULTANTE EN SINDROME CAQUECTICO"
B227,472,"ENFERMEDAD POR VIH, RESULTANTE EN ENFERMEDADES MULTIPLES CLASIFICADAS EN OTRA PARTE"
B230,473,SINDROME DE INFECCION AGUDA DEBIDA A VIH
B231,474,"ENFERMEDAD POR VIH, RESULTANTE EN LINFADENOPATIA GENERALIZADA (PERSISTENTE)"
B232,475,"ENFERMEDAD POR VIH, RESULTANTE EN ANORMALIDADES INMUNOLOGICAS Y HEMATOLOGICAS, NO CLASIFICADAS EN OTRA PARTE"
B238,476,"ENFERMEDAD POR VIH, RESULTANTE EN OTRAS AFECCIONES ESPECIFICADAS"
B24,477,"ENFERMEDAD POR VIRUS DE LA INMUNODEFICIENCIA HUMANA (VIH), SIN OTRA ESPECIFICACION"
B250,478,NEUMONITIS DEBIDA A VIRUS CITOMEGALICO (J17.1*)
B251,479,HEPATITIS DEBIDA A VIRUS CITOMEGALICO
B252,480,PANCREATITIS DEBIDA A VIRUS CITOMEGALICO
B258,481,OTRAS ENFERMEDADES DEBIDAS A VIRUS CITOMEGALICO
B259,482,"ENFERMEDAD POR VIRUS CITOMEGALICO, NO ESPECIFICADA"
B260,483,ORQUITIS POR PAROTIDITIS (N51.1*)
B261,484,MENINGITIS POR PAROTIDITIS (G02.0*)
B262,485,ENCEFALITIS POR PAROTIDITIS (G05.1*)
B263,486,PANCREATITIS POR PAROTIDITIS (K87.1*)
B268,487,PAROTIDITIS INFECCIOSA CON OTRAS COMPLICACIONES
B269,488,"PAROTIDITIS, SIN COMPLICACIONES"
B270,489,MONONUCLEOSIS DEBIDA A HERPES VIRUS GAMMA
B271,490,MONONUCLEOSIS POR CITOMEGALOVIRUS
B278,491,OTRAS MONONUCLEOSIS INFECCIOSAS
B279,492,"MONONUCLEOSIS INFECCIOSA, NO ESPECIFICADA"
B300,493,QUERATOCONJUNTIVITIS DEBIDA A ADENOVIRUS (H19.2*)
B301,494,CONJUNTIVITIS DEBIDA A ADENOVIRUS (H13.1*)
B302,495,FARINGOCONJUNTIVITIS VIRAL
B303,496,CONJUNTIVITIS EPIDEMICA AGUDA HEMORRAGICA (ENTEROVIRICA) (H13.1*)
B308,497,OTRAS CONJUNTIVITIS VIRALES (H13.1*)
B309,498,"CONJUNTIVITIS VIRAL, SIN OTRA ESPECIFICACION"
B330,499,MIALGIA EPIDEMICA
B331,500,ENFERMEDAD DEL RIO ROSS
B332,501,CARDITIS VIRAL
B333,502,"INFECCIONES DEBIDAS A RETROVIRUS, NO CLASIFICADAS EN OTRA PARTE"
B338,503,OTRAS ENFERMEDADES VIRALES ESPECIFICADAS
B340,504,"INFECCION DEBIDA A ADENOVIRUS, SIN OTRA ESPECIFICACION"
B341,505,"INFECCION DEBIDA A ENTEROVIRUS, SIN OTRA ESPECIFICACION"
B342,506,"INFECCION DEBIDA A CORONAVIRUS, SIN OTRA ESPECIFICACION"
B343,507,"INFECCION DEBIDA A PARVOVIRUS, SIN OTRA ESPECIFICACION"
